{
 "version": 1,
 "task": {
  "instruction": "Write the repository README for a Claude Code plugin marketplace of three plugins.",
  "world": {
   "as_of": "2026-10-28",
   "scope": "what each plugin is for, how to install and start it, what it needs, and where the rules live",
   "deliverable": "a README a new visitor reads to decide on, install and start the plugins"
  },
  "evidence_goal": "a visitor can pick a plugin, install it and start using it from the page alone",
  "use": [
   "human"
  ],
  "source": "https://github.com/kalaluthien/mumu-claude-plugin/blob/74b7410/README.md"
 },
 "tiers": [
  {
   "id": "decide-and-install",
   "name": "A visitor can pick and install a plugin",
   "delta": 0.25,
   "judge_error": 0.05,
   "criteria": [
    {
     "id": "purpose-each-plugin",
     "text": "The opening paragraph says in one clause per plugin what teamwork, paperwork and homework each do.",
     "polarity": "+",
     "check": "judge",
     "provenance": {
      "kind": "expert-failure",
      "source": "a visitor could not tell from the top what each plugin is for"
     },
     "variants_ok": [
      "A list of three bullets, one clause each.",
      "One sentence per plugin."
     ],
     "near_miss": [
      "It names the three plugins but only says they help with Claude Code."
     ]
    },
    {
     "id": "install-commands",
     "text": "The Installation section gives a marketplace-add command and one install command for each of the three plugins.",
     "polarity": "+",
     "check": "program",
     "provenance": {
      "kind": "expert-failure",
      "source": "a reader could not install from the page alone"
     }
    },
    {
     "id": "needs-listed",
     "text": "A table or list states what each plugin needs on the machine (tools, accounts, versions).",
     "polarity": "+",
     "check": "judge",
     "provenance": {
      "kind": "expert-failure",
      "source": "an install failed for a missing tool the page never named"
     },
     "variants_ok": [
      "A table with one row per plugin."
     ],
     "near_miss": [
      "It says to install Python but names no tool the other plugins need."
     ]
    },
    {
     "id": "works-alone",
     "text": "The page states that each plugin works without the others.",
     "polarity": "+",
     "check": "judge",
     "provenance": {
      "kind": "expert-failure",
      "source": "a reader assumed all three plugins must be installed together"
     },
     "variants_ok": [
      "'Each plugin works alone.'"
     ],
     "near_miss": [
      "It says the plugins are designed to be used together."
     ]
    }
   ]
  },
  {
   "id": "start-and-trust",
   "name": "A visitor can start a plugin and trust the page",
   "delta": 0.25,
   "judge_error": 0.1,
   "criteria": [
    {
     "id": "usage-each-plugin",
     "text": "Each plugin's section holds a usage example or a named command that starts it.",
     "polarity": "+",
     "check": "judge",
     "provenance": {
      "kind": "expert-failure",
      "source": "a reader installed a plugin and did not know how to begin"
     },
     "variants_ok": [
      "A code block with a prompt.",
      "A slash command in a bullet."
     ],
     "near_miss": [
      "A section that describes the plugin and gives no way to start it."
     ]
    },
    {
     "id": "relative-links-resolve",
     "text": "Every relative link in the page points to a file or folder that exists at the graded commit.",
     "polarity": "+",
     "check": "program",
     "provenance": {
      "kind": "expert-failure",
      "source": "a link led to a removed file"
     }
    },
    {
     "id": "backtick-paths-exist",
     "text": "Every file path the page writes in backticks with a plugin folder prefix exists at the graded commit.",
     "polarity": "-",
     "check": "program",
     "provenance": {
      "kind": "expert-failure",
      "source": "a named script had been renamed"
     }
    },
    {
     "id": "terms-defined",
     "text": "The teamwork roles (owner, manager, worker, sentinel, judge) are each defined in one line before the usage example.",
     "polarity": "+",
     "check": "judge",
     "provenance": {
      "kind": "expert-failure",
      "source": "a reader met 'sentinel' with no meaning"
     },
     "variants_ok": [
      "A bullet list of role definitions above Usage."
     ],
     "near_miss": [
      "Roles defined only in a linked document."
     ]
    },
    {
     "id": "install-pins-tag",
     "text": "The marketplace-add command pins a version tag that exists in the repository.",
     "polarity": "+",
     "check": "program",
     "provenance": {
      "kind": "expert-failure",
      "source": "an install pinned a tag that did not exist"
     }
    }
   ]
  },
  {
   "id": "pitfalls-and-polish",
   "name": "Common pitfalls of a README",
   "criteria": [
    {
     "id": "tool-unexplained",
     "text": "A required outside tool (herdr, uv, pele, Alloy, gh) appears with neither a link nor a gloss at its first mention.",
     "polarity": "-",
     "check": "judge",
     "provenance": {
      "kind": "expert-failure",
      "source": "a reader did not know what herdr is"
     },
     "anchors": "A link or a clause saying what the tool is counts as a gloss.",
     "variants_ok": [
      "herdr with a link to its site."
     ],
     "near_miss": [
      "herdr named alone in a sentence."
     ]
    },
    {
     "id": "long-line",
     "text": "A prose line in the page is over 400 characters.",
     "polarity": "-",
     "check": "program",
     "provenance": {
      "kind": "expert-failure",
      "source": "a dense bullet hid its point"
     }
    },
    {
     "id": "states-license",
     "text": "The page names its license and links the license file.",
     "polarity": "+",
     "check": "program",
     "provenance": {
      "kind": "expert-failure",
      "source": "a reader could not tell if they may reuse the code"
     }
    },
    {
     "id": "diagram-has-caption",
     "text": "Each diagram sits under a one-sentence summary saying what it shows.",
     "polarity": "+",
     "check": "judge",
     "provenance": {
      "kind": "expert-failure",
      "source": "a diagram showed with no stated point"
     },
     "variants_ok": [
      "A details summary sentence above the diagram."
     ],
     "near_miss": [
      "A diagram with no sentence."
     ]
    }
   ]
  }
 ],
 "exchange": [
  {
   "a": "purpose-each-plugin",
   "b": "install-commands",
   "result": "same",
   "by": "claude"
  },
  {
   "a": "install-commands",
   "b": "needs-listed",
   "result": "same",
   "by": "claude"
  },
  {
   "a": "needs-listed",
   "b": "works-alone",
   "result": "same",
   "by": "claude"
  },
  {
   "a": "works-alone",
   "b": "purpose-each-plugin",
   "result": "same",
   "by": "claude"
  },
  {
   "a": "purpose-each-plugin",
   "b": "usage-each-plugin",
   "result": "a_over_b",
   "by": "claude",
   "note": "a README with no stated purpose is skipped before any usage is read"
  },
  {
   "a": "install-commands",
   "b": "relative-links-resolve",
   "result": "a_over_b",
   "by": "claude",
   "note": "no install command blocks every use; a dead link blocks one detour"
  },
  {
   "a": "needs-listed",
   "b": "terms-defined",
   "result": "a_over_b",
   "by": "claude",
   "note": "a missing tool breaks the install; an undefined role only slows reading"
  },
  {
   "a": "works-alone",
   "b": "install-pins-tag",
   "result": "a_over_b",
   "by": "claude",
   "note": "installing all three wastes setup; a bad tag fails and is seen at once"
  },
  {
   "a": "usage-each-plugin",
   "b": "relative-links-resolve",
   "result": "same",
   "by": "claude"
  },
  {
   "a": "relative-links-resolve",
   "b": "backtick-paths-exist",
   "result": "same",
   "by": "claude"
  },
  {
   "a": "backtick-paths-exist",
   "b": "terms-defined",
   "result": "same",
   "by": "claude"
  },
  {
   "a": "terms-defined",
   "b": "install-pins-tag",
   "result": "same",
   "by": "claude"
  },
  {
   "a": "install-pins-tag",
   "b": "usage-each-plugin",
   "result": "same",
   "by": "claude"
  },
  {
   "a": "usage-each-plugin",
   "b": "tool-unexplained",
   "result": "a_over_b",
   "by": "claude",
   "note": "no way to start blocks use; an unglossed tool name slows it"
  },
  {
   "a": "terms-defined",
   "b": "long-line",
   "result": "a_over_b",
   "by": "claude",
   "note": "an undefined role blocks understanding; a long line only tires"
  },
  {
   "a": "install-pins-tag",
   "b": "states-license",
   "result": "a_over_b",
   "by": "claude",
   "note": "a failing install outweighs a missing license line"
  },
  {
   "a": "relative-links-resolve",
   "b": "diagram-has-caption",
   "result": "a_over_b",
   "by": "claude",
   "note": "a dead link blocks; a bare diagram only slows"
  },
  {
   "a": "backtick-paths-exist",
   "b": "tool-unexplained",
   "result": "a_over_b",
   "by": "claude",
   "note": "a named path that is gone misleads; an unglossed tool name slows"
  },
  {
   "a": "tool-unexplained",
   "b": "long-line",
   "result": "same",
   "by": "claude"
  },
  {
   "a": "long-line",
   "b": "states-license",
   "result": "same",
   "by": "claude"
  },
  {
   "a": "states-license",
   "b": "diagram-has-caption",
   "result": "same",
   "by": "claude"
  },
  {
   "a": "diagram-has-caption",
   "b": "tool-unexplained",
   "result": "same",
   "by": "claude"
  }
 ],
 "judge": {
  "mode": "full_rubric",
  "model": "claude-sonnet-5-5",
  "calibration": {
   "human_labels": 0,
   "macro_f1": null,
   "met_rate_gap": null,
   "estimated": true
  }
 }
}