{
 "version": 1,
 "task": {
  "instruction": "Grade check-plan.py and tree_plan.py as the checker of tree plan files.",
  "world": {
   "as_of": "2026-10-28",
   "scope": "paperwork/skills/tree/scripts/check-plan.py and paperwork/lib/tree_plan.py at commit 74b7410",
   "deliverable": "a command-line checker run by the tree skill's author and fixtures"
  },
  "evidence_goal": "the checker accepts every valid plan, refuses every malformed one with a named rule, and follows the repository's script rules",
  "use": [
   "eval"
  ]
 },
 "group_size": 4,
 "tiers": [
  {
   "id": "verdict",
   "name": "gives the right verdict",
   "delta": 0.2,
   "judge_error": 0.02,
   "criteria": [
    {
     "id": "accepts-valid",
     "text": "Run on a valid plan file, the script prints `ok 1` and exits 0.",
     "polarity": "+",
     "check": "program",
     "provenance": {
      "kind": "expert-failure",
      "source": "a checker that refuses a valid plan blocks the owner's page"
     }
    },
    {
     "id": "refuses-unknown-key",
     "text": "Run on a plan with an unknown key, the script exits 1 with the rule name `unknown-key` in its output.",
     "polarity": "+",
     "check": "program",
     "provenance": {
      "kind": "expert-failure",
      "source": "a checker that accepts a malformed plan lets a broken page reach the owner"
     }
    },
    {
     "id": "refuses-duplicate-key",
     "text": "Run on a plan file that writes one key twice in an object, the script exits 1 and prints the rule name `duplicate-key`.",
     "polarity": "+",
     "check": "program",
     "provenance": {
      "kind": "near-miss",
      "source": "json.loads keeps only the last duplicate, so a plain loader accepts it"
     }
    },
    {
     "id": "refuses-missing-source",
     "text": "Run on a plan holding an `evidence` part without a source, the script exits 1 with the rule name `evidence-needs-source` in its output.",
     "polarity": "+",
     "check": "program",
     "provenance": {
      "kind": "expert-failure",
      "source": "evidence with no source cannot be opened by the reader"
     }
    }
   ]
  },
  {
   "id": "robust",
   "name": "fails safe and in form for the caller",
   "delta": 0.3,
   "judge_error": 0.02,
   "criteria": [
    {
     "id": "usage-exit-2",
     "text": "Run with no argument, the script exits 2, prints nothing on stdout and prints its docstring on stderr.",
     "polarity": "+",
     "check": "program",
     "provenance": {
      "kind": "source-rubric",
      "source": "AGENTS.md Script form"
     }
    },
    {
     "id": "unreadable-reported",
     "text": "Run on a path that does not exist, the script exits 1 and prints a line holding `unreadable`, with no `Traceback` on stderr.",
     "polarity": "+",
     "check": "program",
     "provenance": {
      "kind": "expert-failure",
      "source": "a stack trace hides which file was wrong"
     }
    },
    {
     "id": "bad-encoding-reported",
     "text": "Run on a file of invalid UTF-8 bytes, the script exits 1 with an error line and no `Traceback` on stderr.",
     "polarity": "+",
     "check": "program",
     "provenance": {
      "kind": "near-miss",
      "source": "UnicodeDecodeError is not an OSError, a gap the handler may miss"
     }
    },
    {
     "id": "expect-refused-summary",
     "text": "Run with `--expect-refused` on one refused plan file, the script prints a last line `refused 1 of 1` and exits 0.",
     "polarity": "+",
     "check": "program",
     "provenance": {
      "kind": "source-rubric",
      "source": "the docstring's second usage line"
     }
    }
   ]
  },
  {
   "id": "upkeep",
   "name": "easy to keep",
   "criteria": [
    {
     "id": "docstring-form",
     "text": "The script's docstring opens with a purpose sentence and holds one `usage:` line per call form.",
     "polarity": "+",
     "check": "program",
     "provenance": {
      "kind": "source-rubric",
      "source": "AGENTS.md Script form"
     }
    },
    {
     "id": "main-form",
     "text": "The script defines `def main(args)` and ends with `sys.exit(main(sys.argv[1:]))`.",
     "polarity": "+",
     "check": "program",
     "provenance": {
      "kind": "source-rubric",
      "source": "AGENTS.md Script form"
     }
    },
    {
     "id": "rule-names-documented",
     "text": "Every rule name that `tree_plan.check` can emit appears in the tree skill's `references/grammar.md`.",
     "polarity": "+",
     "check": "program",
     "provenance": {
      "kind": "near-miss",
      "source": "a rule the author cannot look up leaves the error unexplained"
     }
    },
    {
     "id": "lib-no-io",
     "text": "`tree_plan.py` opens a file only in `load_file` and imports no network module.",
     "polarity": "+",
     "check": "program",
     "provenance": {
      "kind": "source-rubric",
      "source": "the lib docstring: every function is a calculation"
     }
    },
    {
     "id": "comment-restates-code",
     "text": "A comment in either file restates what the next line does instead of why.",
     "polarity": "-",
     "check": "judge",
     "provenance": {
      "kind": "source-rubric",
      "source": "AGENTS.md Comments say why"
     },
     "anchors": "restates: removing the comment loses no reason, only a paraphrase of the code line.",
     "variants_ok": [
      "# A *-plan.json is the valid plan an answer fixture is applied to, so it is checked to be accepted"
     ],
     "near_miss": [
      "# loop over the files"
     ]
    }
   ]
  }
 ],
 "exchange": [
  {
   "a": "accepts-valid",
   "b": "refuses-unknown-key",
   "result": "same",
   "by": "claude"
  },
  {
   "a": "refuses-duplicate-key",
   "b": "refuses-missing-source",
   "result": "same",
   "by": "claude"
  },
  {
   "a": "refuses-unknown-key",
   "b": "refuses-duplicate-key",
   "result": "same",
   "by": "claude"
  },
  {
   "a": "refuses-unknown-key",
   "b": "usage-exit-2",
   "result": "a_over_b",
   "by": "claude"
  },
  {
   "a": "usage-exit-2",
   "b": "unreadable-reported",
   "result": "same",
   "by": "claude"
  },
  {
   "a": "bad-encoding-reported",
   "b": "expect-refused-summary",
   "result": "same",
   "by": "claude"
  },
  {
   "a": "unreadable-reported",
   "b": "bad-encoding-reported",
   "result": "same",
   "by": "claude"
  },
  {
   "a": "docstring-form",
   "b": "main-form",
   "result": "same",
   "by": "claude"
  },
  {
   "a": "rule-names-documented",
   "b": "lib-no-io",
   "result": "same",
   "by": "claude"
  },
  {
   "a": "main-form",
   "b": "comment-restates-code",
   "result": "same",
   "by": "claude"
  },
  {
   "a": "accepts-valid",
   "b": "usage-exit-2",
   "result": "a_over_b",
   "by": "claude",
   "note": "a wrong verdict misleads the caller; a wrong usage code only confuses it"
  },
  {
   "a": "refuses-missing-source",
   "b": "unreadable-reported",
   "result": "a_over_b",
   "by": "claude"
  },
  {
   "a": "refuses-duplicate-key",
   "b": "bad-encoding-reported",
   "result": "a_over_b",
   "by": "claude"
  },
  {
   "a": "usage-exit-2",
   "b": "docstring-form",
   "result": "a_over_b",
   "by": "claude"
  },
  {
   "a": "expect-refused-summary",
   "b": "main-form",
   "result": "a_over_b",
   "by": "claude"
  },
  {
   "a": "unreadable-reported",
   "b": "lib-no-io",
   "result": "a_over_b",
   "by": "claude"
  },
  {
   "a": "bad-encoding-reported",
   "b": "rule-names-documented",
   "result": "a_over_b",
   "by": "claude"
  }
 ],
 "judge": {
  "mode": "full_rubric",
  "model": "claude-sonnet-5-5",
  "calibration": {
   "human_labels": 0,
   "macro_f1": null,
   "met_rate_gap": null,
   "estimated": true
  }
 },
 "monitor": [
  "program checks and the judge criterion disagree on the same file"
 ]
}